[
  {
    "paper_id": "openalex:W1",
    "title": "Citing Seed Paper",
    "authors": [{"name": "Jane Doe"}],
    "year": 2025,
    "publication_date": "2025-01-01",
    "venue": {"name": "Journal", "type": "journal", "issn": []},
    "doi": "10.1/citing",
    "arxiv_id": null,
    "openalex_id": "W1",
    "semantic_scholar_id": null,
    "abstract": "x",
    "citation_count": 10,
    "is_retracted": false,
    "is_paratext": false,
    "topics": [{"topic": "Retrieval"}],
    "relations_to_seed": [{"seed_id": "seed-001", "relation": "cites_seed", "source": "openalex", "evidence": "filter=cites:W0"}],
    "open_access": {"is_oa": true, "oa_status": "green", "best_pdf_url": "https://example.org/citing.pdf", "landing_page_url": "https://example.org", "source": "openalex.best_oa_location"},
    "download": {"status": "not_attempted", "file": null, "sha256": null, "bytes": 0, "source": null, "failure_reason": null},
    "scores": {},
    "ranking_reason": "",
    "needs_review": false,
    "provenance": {"sources": ["openalex"], "retrieved_at": "2026-05-26T00:00:00+00:00"}
  },
  {
    "paper_id": "openalex:W2",
    "title": "Keyword Only Paper",
    "authors": [{"name": "John Doe"}],
    "year": 2010,
    "publication_date": "2010-01-01",
    "venue": {},
    "doi": "10.1/keyword",
    "arxiv_id": null,
    "openalex_id": "W2",
    "semantic_scholar_id": null,
    "abstract": "x",
    "citation_count": 1,
    "is_retracted": false,
    "is_paratext": false,
    "topics": [],
    "relations_to_seed": [{"seed_id": "seed-001", "relation": "keyword_only", "source": "openalex", "evidence": "search"}],
    "open_access": {"is_oa": false, "oa_status": null, "best_pdf_url": null, "landing_page_url": null, "source": "openalex"},
    "download": {"status": "not_attempted", "file": null, "sha256": null, "bytes": 0, "source": null, "failure_reason": null},
    "scores": {},
    "ranking_reason": "",
    "needs_review": false,
    "provenance": {"sources": ["openalex"], "retrieved_at": "2026-05-26T00:00:00+00:00"}
  }
]
